{
  "schemaVersion": "rd-case.v1alpha1",
  "id": "member-list-filter-001",
  "title": "Member-list filtering and pagination",
  "taskType": "frontend-feature",
  "roles": [
    "frontend-engineer",
    "product-manager",
    "qa-engineer"
  ],
  "stack": [
    "react",
    "typescript"
  ],
  "difficulty": "easy",
  "source": {
    "type": "synthetic",
    "approved": true,
    "anonymized": true,
    "license": "Apache-2.0",
    "maintainer": "rd-team demo maintainers"
  },
  "baseline": {
    "repository": "example/member-console",
    "commit": "demo-baseline-v1"
  },
  "tags": [
    "filter",
    "pagination",
    "member-list",
    "成员",
    "列表",
    "筛选",
    "分页"
  ],
  "module": "members",
  "version": "0.1.0",
  "expiresAt": "2027-09-28",
  "summary": "Changing a filter resets pagination. Filtering and pagination share request parameters, and only the current request may update results."
}
