{
  "schemaVersion": "rd-case.v1alpha1",
  "id": "member-api-review-003",
  "title": "Member query API review",
  "taskType": "backend-feature",
  "roles": [
    "backend-engineer",
    "code-reviewer",
    "qa-engineer"
  ],
  "stack": [
    "nodejs",
    "typescript"
  ],
  "difficulty": "easy",
  "source": {
    "type": "synthetic",
    "approved": true,
    "anonymized": true,
    "license": "Apache-2.0",
    "maintainer": "rd-team demo maintainers"
  },
  "baseline": {
    "repository": "example/member-console",
    "commit": "demo-baseline-v1"
  },
  "tags": [
    "api",
    "validation",
    "rbac",
    "成员",
    "权限",
    "接口"
  ],
  "module": "members",
  "version": "0.1.0",
  "expiresAt": "2027-09-28",
  "summary": "Bound pagination inputs, check authorization on the server, and use explicit error codes."
}
